{"schema":"daee-negative-fixture-expectation-v1","fixture":"eligible-owner-unexecuted.json","kind":"invalid-single-signature","expected_checker_id":"owner-obligation-coverage","expected_exit_category":"validation-failure","expected_exit_code":1,"expected_earliest_stage":"04","expected_failure_class":"owner-obligation-coverage","expected_failure_subcode":"eligible-obligation-unpaid","expected_downstream_invalidated":["05","06","07","08"],"required_diagnostic_markers":["O-cd7aade8cee23cb05b941960","eligible-obligation-unpaid"],"forbidden_artifacts":["stage-05-reread.json","stage-07-output.md","promotion-verdict.json"],"provenance":"A15 preserved already-green A04 inverse owner-obligation regression neighbor"}
