{"schema":"daee-negative-fixture-expectation-v1","fixture":"right-reason-stage04.verdict.json","kind":"invalid-single-signature","expected_checker_id":"manual-smoke-render-contract","expected_exit_category":"structural-rejection","expected_exit_code":1,"expected_earliest_stage":"04","expected_failure_class":"act_body_ref","expected_failure_subcode":"body-ref-missing","expected_downstream_invalidated":["05","06","07","08"],"required_diagnostic_markers":["body-ref-missing"],"forbidden_artifacts":["tests/validation-integrity/artifacts/forbidden-promotion.json"],"provenance":"A11 external right-reason Stage04 canary"}
